<?xml version="1.0" encoding="UTF-8" ?>
<?xml-stylesheet type="text/xsl" href="books.xsl"?>
<books xmlns:xsi="http://www.w3.org/2001/XMLSchema-instance" xsi:noNamespaceSchemaLocation="books.xsd">
    <book>
        <bookId>1</bookId>
        <booktitle>Good mates</booktitle>
        <author>Author Choi</author>
        <category>Science Fiction</category>
        <condition>New</condition>
        <isbn>1-23451-234-5</isbn>
        <publishYear>2018</publishYear>
        <publisher>Jimmy Rhee</publisher>
        <username>kevin</username>
        <abstract>A tale of good mates.</abstract>
        <availability>Reserved</availability>
    </book>
    <book>
        <bookId>2</bookId>
        <booktitle>Romeo and Juliet</booktitle>
        <author>William Shakespeare</author>
        <category>Romance</category>
        <condition>New</condition>
        <isbn>2-34567-789-1</isbn>
        <publishYear>1985</publishYear>
        <publisher>Jimmy Rhee</publisher>
        <username>kevin</username>
        <abstract>A legendary love story.</abstract>
        <availability>Reserved</availability>
    </book>
    <book>
        <bookId>3</bookId>
        <booktitle>Romeo and Juliet</booktitle>
        <author>William Shakespeare</author>
        <category>Romance</category>
        <condition>Good</condition>
        <isbn>2-34567-789-1</isbn>
        <publishYear>1985</publishYear>
        <publisher>Jimmy Rhee</publisher>
        <username>kevin</username>
        <abstract>A legendary love story.</abstract>
        <availability>Available</availability>
    </book>
    <book>
        <bookId>4</bookId>
        <booktitle>Good mates</booktitle>
        <author>Author Choi</author>
        <category>Science Fiction</category>
        <condition>Fair</condition>
        <isbn>1-23451-234-5</isbn>
        <publishYear>2018</publishYear>
        <publisher>Jimmy Rhee</publisher>
        <username>jimmy</username>
        <abstract>A tale of good mates.</abstract>
        <availability>Available</availability>
    </book>
    <book>
        <bookId>5</bookId>
        <booktitle>Triangle</booktitle>
        <author>Mac Barnett</author>
        <category>Picture Books</category>
        <condition>Poor</condition>
        <isbn>3-95231-883-7</isbn>
        <publishYear>1990</publishYear>
        <publisher>Jimmy Rhee</publisher>
        <username>kevin</username>
        <abstract>Meet Triangle, a geometry shape.</abstract>
        <availability>Available</availability>
    </book>
</books>